author,name,desc,detail,dwnld
Иван Чепурнов,Распродажа курсов,,https://vk.com/wall-162701014_2506,https://cloud.mail.ru/public/rHDp/34ZpAVcWB
Дамир Халилов,SMM профессионал. Пакет Gold (2019),"Программа 24 модуля:

Блок 1. 2 месяца погружения в профессию SMM-специалист

Базовые навыки SMM-специалиста
Работа с контентом
Продвижение в Instagram
Продвижение во Вконтакте
Продвижение на Facebook
Продвижение на YouTube
Таргетированная реклама
Продажи через социальные сети
Оценка эффективности
Дизайн для социальных сетей
Как продавать свои услуги
Блок 2. Получите наиболее полные и объемные знания о том, как работает SMM на самом деле

11 блоков базового курса
Развитие SMM-специалиста
Дополнительные инструменты продвижения
Снижаем стоимость таргетированной рекламы х3
ПроРазработка SMM-стратегии для клиента
Работа с мобильными мессенджерами
Блок 3. Получите самые актуальные знания в SMM для организации своего SMM агенства

Пакет VIP
Новейшие инструменты SMM-продвижения
Построение SMM-агентства с нуля до оборота в миллион рублей в месяц
Личная эффективность SMM-предпринимателя
Как продавать услуги за 100 000+ рублей
Репутационный менеджмент: как нейтрализовать негатив
Методики креативного менеджмента: как придумывать сногсшибательные идеи
Команда для SMM-бизнеса: найм, контроль, руководство
Персональный бренд SMM-специалиста: как обеспечить пассивный поток продаж",http://pro.smm-2019.ru/kurs/,https://yadi.sk/d/DmXFTGI9BbQZfQ
,"#SMMСПЕЦНАЗ - Вконтакте, Facebook, Instagram, myTarget, Youtube",,smmspecialforces.conversion.im,"https://cloud.mail.ru/public/Lx52/EQm8U29p5
Пароль: www.coga.biz"
Павел Гуров,"Основы маркетинга в Instagram, Facebook, Twitter и Telegram (2020)","Автор курса Павел Гуров — знаменитый SMM-специалист, автор стремительного развивающегося канала Gurov Digital и одноимённого подкаста о соцсетях.

В портфеле агентства Павла Гурова и крупные мировые бренды, и микробизнес, и творческие проекты, и компании, нацеленные сугубо на продажи.

Опираясь на личную практику и запросы аудитории, Павел собрал в одном курсе мощнейший базовый материал в доступной и интересной форме, с примерами и рекомендациями, которые вы можете применить уже с первого занятия.




Спойлер: Содержание курса



Курс рекомендован для тех, кто желает упорядочить знания в маркетинге и погрузиться в правильные белые надёжные методы продвижения профессионалов.

Видеозапись поделена на три логические части по 2 часа.








Учебный материал проработан с методистами и отснят в профессиональной студии, чтобы лекции смотрелись легко, а преподавателя было отлично слышно и всё хорошо видно в кадре.


Спойлер: Бонус



Дарим
Пожалуй, самую знаменитую в интернете видеозапись лекции Павла Гурова об инстаграме. Эта лекция по праву считается бестселлером в сети!

Контент
Хронометраж видеозаписи 2 часа 8 минут, традиционно, на странице курса размещены материалы из лекции.

Тезисы

Торговые метки (Shopping Tags).
Бизнес-приложения.
Синяя галочка верификации.
Рекламная карусель из Stories.
Видеоквесты в Stories.
Паззлы в Collections.
Официальные директории хештегов и геолокаций.
Работа с новым алгоритмом.
Профессиональная работа с Highlights.",https://professura.com/base-smm,https://cloud.mail.ru/public/2WSw/ijJ1ef1mE
Церебро Таргет,Обучение от Церебро: активности и продажи (2018),"Первый блок — активация подписчиков
Как получить больше просмотров, при тех же трудозатратах
Вы узнаете как правильно использовать рекомендации по работе с умной лентой, которые позволят при тех же трудозатратах получить в разы больше просмотров ваших постов.

Сколько человек в вашем сообществе? А сколько из них видят выпущенный пост? Скорее всего эта цифра не больше 3-5%, в Церебро это 7-9%. Задаче повышения охвата постов, соблюдениями правил ВК посвящено первое занятие этого блока.

Второй блок — подготовка площадки
Выявим на каких 3х китах базируется продающая группа ВКонтакте.

Как определить целевую аудиторию проекта и выявить ее боли. Работа с ЦереброТаргет.
Разбора универсального алгоритма поиска боли целевой аудитории. Он поможет не только лучше понять потенциальных клиентов и говорить с ними на одном языке, но и быстро сориентироваться в проекте клиента, даже если ты “девушка, которая любит платья, а клиенту нужно продвинуть полигон для страйкбола”.

Блок третий — трафик
Введение в таргетинг ВКонтакте для новичков.
Вы разберетесь во всех возможных способах продвижения ВКонтакте, в чем их плюсы / минусы и за какие можно улететь в бан.

Более глубоко остановимся на таргетинге: как выстраивается конкуренция рекламодателей на аукционе, какие существуют требования к рекламным материалам, как создать и пополнить рекламный кабинет, и какие настройки в нем работают максимально эффективно.",https://vk.com/@cerebro_vk-kurs-ot-cerebrotarget,https://cloud.mail.ru/public/5tzj/WrmAUX2Y4
Мария Солодар,Школа интернет-маркетинга (2018),"За время обучения в Школе Маркетологов вы разберете все темы интернет-маркетинга от копирайтинга до трафика, выполните по каждой из них домашнее задание и получите полноценный фидбек от специалиста.


Также вы научитесь увеличивать прибыль проекта\компания при меньших затратах на рекламу.

Откроете для себя новые термины: апсел, даунсел, кроссел, лонгтейл, ото и т.д., а главное, поймете, как с их помощью делать деньги.

Узнаете, чем отличается продуктовая линейка от воронки продаж и дороги путешествия клиента, и как это все работает в комплексе.

Поймете, что должно быть в вашей емейл-рассылке, чтобы это был полноценный инструмент продаж, а не +1 письмо в папке “Спам”.

Получите детальные структуры и схемы по написанию писем, созданию лендингов, а также разработке воронки продаж.

И конечно же, соберете все эти знания воедино, чтобы заставить маркетинговую машину работать на вас и генерировать прибыль.

А еще вы прослушаете лекции по темам (вы даже не могли подумать, что это все тоже должен знать маркетолог): организация отдела продаж, верстка и программирование страниц, аналитика и др.

После обучения вы будете мыслить стратегически и сможете сопоставить полученные знания с генерацией прибыли.",https://mariyasolodar.com/lp/marketers-school,https://cloud.mail.ru/public/42Cp/4nrGgYwh6
SMM-Школа Republic,Профессия SMM-щик (2018-2019),,http://anonym.to/?http://smm.republicmedia.ru/,https://yadi.sk/d/jJiWJFIFRLgHqA
,,,https://mariyasolodar.com/lp/smm/product/,"Магнет-ссылка: magnet:?xt=urn:btih:1E7A76A73FA8F81FB6238EBAEF94D1A87375B12E
❓ Как скачать файл по magnet-ссылке при помощи µTorrent ❓"
EnjoySMM,Обучение заработку в Инстаграм (2019),,http://enjoysmm.ru/,https://cloud.mail.ru/public/2nRN/5HMqD1zVQ
Александр Алимов,Гиперсегментатор 2.0 (2018),"Единственный практический авторский курс повышения квалификации для специалистов контекстной рекламы по концепции гиперсегментации от основателя YAGLA Алимова Александра.

Здесь вам не станут рассказывать про то, как генерить семантику, структурировать аккаунт, тыкать в кнопочки интерфейса Яндекс Директ и Google AdWords, насколько важен CTR, какой аукцион Яндекс использует для определения цены клика, как обойти модерацию – это все есть в справках Яндекс & Google. Пусть об этом вам расскажут другие...

Готовьтесь перевернуть свое представление о релевантности, конкуренции, правильных маркетинговых связках и подходу к ведению контекстной рекламы в целом!

В результате прохождения курса Вы:

поймете преимущества своего продукта и опишете свою аудиторию. По результатам прошлого курса мы выяснили, что свою аудиторию правильно понимают только 10% собственников и специалистов;
поймете с кем Вы конкурируете;
подготовите все для запуска рекламных кампаний;
научитесь продавать дорогие туры по запросам «деканат МГИМО», видеорегистраторы по запросам «штрафы ГИБДД», а доставку еды по запросам «рецепт плова»;
научитесь с высокой вероятностью конвертировать дешевый околоцелевой трафик в качественных лидов;
классифицируете запросы в своих рекламных кампаниях на поиске;
отранжируете запросы по уровню важности, поймете с кем вы конкурируете;
научитесь повышать вероятности конвертации посетителей из поиска в лидов;
перестанете совершать ошибки, которые совершают 97% специалистов контекстной рекламы;
системно научитесь улучшать показатели рекламных кампаний;
проведете тестирование маркетинговых связок;
поймете как можно даже через несколько месяцев иметь потенциал роста.",http://alimov.info/,"https://cloud.mail.ru/public/291y/YGm3YfjYw
Пароль: www.sharewood.biz"
